{
  "schemaVersion": "1.0",
  "workflowId": "top-skill-2-repair-artifact-dogfood",
  "passId": "judicial",
  "taskId": "judicial-task",
  "role": "judicial",
  "agentName": "judicial-llm-api-pass",
  "taskCapsuleRef": "capsules/judicial.task-capsule.json",
  "inputReferences": [
    "handoffs/repair-1.handoff.json",
    "invocations/repair-1.invocation-evidence.json",
    "artifacts/repair-target.json"
  ],
  "outputReferences": [
    "handoffs/judicial.handoff.json"
  ],
  "filesRead": [
    "capsules/judicial.task-capsule.json",
    "contexts/judicial.context-package.json"
  ],
  "filesChanged": [
    "handoffs/judicial.handoff.json"
  ],
  "commandsRun": [
    "scripts/adapters/llm_api_adapter.py"
  ],
  "status": "done",
  "executionEvidence": {
    "executionIsolationLevel": "protocol-followed-by-agent",
    "verificationEvidenceLevel": "agent-claimed",
    "runnerName": null,
    "separateInvocationIds": [],
    "schemaValidationCommand": null,
    "hardCheckCommands": [],
    "limitations": [
      "Pass handoff may claim only protocol-followed-by-agent evidence; runner-enforced evidence is assigned by the runner."
    ]
  },
  "limitations": [],
  "didNotDo": [
    "repair implementation artifacts",
    "certify delivery complete",
    "use hidden prior chat"
  ],
  "handoffTo": "orchestrator",
  "mayEditFiles": false,
  "mayValidate": true,
  "mayRepair": false,
  "mayReport": true,
  "mayCertifyDelivery": false
}
