{
  "schemaVersion": "1.0",
  "workflowId": "top-skill-2-repair-loop-dogfood",
  "passId": "judicial-initial",
  "taskId": "judicial-initial-task",
  "role": "judicial",
  "agentName": "judicial-llm-api-pass",
  "taskCapsuleRef": "capsules/judicial-initial.task-capsule.json",
  "inputReferences": [
    "handoffs/executive.handoff.json",
    "invocations/executive.invocation-evidence.json"
  ],
  "outputReferences": [
    "handoffs/judicial-initial.handoff.json"
  ],
  "filesRead": [
    "capsules/judicial-initial.task-capsule.json",
    "contexts/judicial-initial.context-package.json"
  ],
  "filesChanged": [
    "handoffs/judicial-initial.handoff.json"
  ],
  "commandsRun": [
    "scripts/adapters/llm_api_adapter.py"
  ],
  "status": "done",
  "executionEvidence": {
    "executionIsolationLevel": "protocol-followed-by-agent",
    "verificationEvidenceLevel": "agent-claimed",
    "runnerName": null,
    "separateInvocationIds": [],
    "schemaValidationCommand": null,
    "hardCheckCommands": [],
    "limitations": [
      "Pass handoff may claim only protocol-followed-by-agent evidence; runner-enforced evidence is assigned by the runner."
    ]
  },
  "limitations": [
    "Validated only the explicitly referenced executive handoff and executive invocation evidence.",
    "Executive handoff status is done and does not claim delivery certification.",
    "Executive invocation evidence reports a fresh LLM API context with receivedOnlyContextPackage true, but runner-enforced isolation is not certified by this judicial handoff.",
    "No hard-check commands were required or run in this judicial pass."
  ],
  "didNotDo": [
    "repair implementation",
    "certify delivery without hard-check evidence"
  ],
  "handoffTo": "orchestrator",
  "mayEditFiles": false,
  "mayValidate": true,
  "mayRepair": false,
  "mayReport": true,
  "mayCertifyDelivery": false
}
