{
  "schemaVersion": "1.0",
  "workflowId": "top-skill-2-repair-loop-dogfood",
  "passId": "judicial-initial",
  "taskId": "judicial-initial-task",
  "role": "judicial",
  "agentName": "judicial-llm-api-pass",
  "taskCapsuleRef": "capsules/judicial-initial.task-capsule.json",
  "inputReferences": [
    "handoffs/executive.handoff.json",
    "invocations/executive.invocation-evidence.json",
    "runner/runner-report.json"
  ],
  "outputReferences": [
    "handoffs/judicial-initial.handoff.json"
  ],
  "filesRead": [
    "capsules/judicial-initial.task-capsule.json",
    "contexts/judicial-initial.context-package.json"
  ],
  "filesChanged": [
    "handoffs/judicial-initial.handoff.json"
  ],
  "commandsRun": [
    "scripts/adapters/llm_api_adapter.py"
  ],
  "status": "not-certified",
  "executionEvidence": {
    "executionIsolationLevel": "protocol-followed-by-agent",
    "verificationEvidenceLevel": "agent-claimed",
    "runnerName": null,
    "separateInvocationIds": [],
    "schemaValidationCommand": null,
    "hardCheckCommands": [],
    "limitations": [
      "Pass handoff may claim only protocol-followed-by-agent evidence; runner-enforced evidence is assigned by the runner."
    ]
  },
  "limitations": [
    "Judicial validation was limited to the explicitly referenced inputs supplied in the context package.",
    "runner/runner-report.json was an explicitly listed input reference but was missing, so no runner-report claims could be validated.",
    "The executive handoff provides only agent-claimed verification evidence and explicitly does not provide independent validation, certification, final audit, or runner-enforced isolation evidence.",
    "The executive invocation evidence indicates a fresh LLM API request using only context package inputs, but runner-enforced isolation cannot be certified by this pass."
  ],
  "didNotDo": [
    "repair implementation",
    "certify delivery without hard-check evidence"
  ],
  "handoffTo": "orchestrator",
  "mayEditFiles": false,
  "mayValidate": true,
  "mayRepair": false,
  "mayReport": true,
  "mayCertifyDelivery": false
}
