{
  "schemaVersion": "1.0",
  "workflowId": "top-skill-2-release-candidate",
  "passId": "judicial-initial",
  "taskId": "judicial-initial-task",
  "role": "judicial",
  "agentName": "judicial-llm-api-pass",
  "taskCapsuleRef": "capsules/judicial-initial.task-capsule.json",
  "inputReferences": [
    "handoffs/executive.handoff.json",
    "invocations/executive.invocation-evidence.json",
    "artifacts/repair-target.json"
  ],
  "outputReferences": [
    "handoffs/judicial-initial.handoff.json"
  ],
  "filesRead": [
    "capsules/judicial-initial.task-capsule.json",
    "contexts/judicial-initial.context-package.json"
  ],
  "filesChanged": [
    "handoffs/judicial-initial.handoff.json"
  ],
  "commandsRun": [
    "scripts/adapters/llm_api_adapter.py"
  ],
  "status": "done",
  "executionEvidence": {
    "executionIsolationLevel": "protocol-followed-by-agent",
    "verificationEvidenceLevel": "agent-claimed",
    "runnerName": null,
    "separateInvocationIds": [],
    "schemaValidationCommand": null,
    "hardCheckCommands": [],
    "limitations": [
      "Pass handoff may claim only protocol-followed-by-agent evidence; runner-enforced evidence is assigned by the runner."
    ]
  },
  "limitations": [
    "Blocking finding for repair: artifacts/repair-target.json is invalid. DriverStatusBadge has statusLabel \"Broken\" and isValid false; expected statusLabel \"Ready\" and isValid true."
  ],
  "didNotDo": [
    "repair implementation artifacts",
    "certify delivery complete",
    "use hidden prior chat"
  ],
  "handoffTo": "repair",
  "mayEditFiles": false,
  "mayValidate": true,
  "mayRepair": false,
  "mayReport": true,
  "mayCertifyDelivery": false
}
